[
    {
        "name": "L04_TreeHugger",
        "path": "Node4D/Node3D/Levels/L04_TreeHugger.tscn",
        "class": "Node3D",
        "type": "scene",
        "children": [{
            "name": "tree_hugger3D",
            "Type": "Node",
            "class": "Node3D",
            "path": "Node4D/Node3D/Levels/L04_TreeHugger/tree_hugger3D.tscn",
            "config": {
                "transform": {
                    "position": {"x": -1000, "y": -500.111, "z": 0},
                    "rotation_degrees": {"x": 0, "y": 0, "z": 0},
                    "scale": {"x": 1, "y": 1, "z": 1}
                }
            },
            "children": [
                {
                    "name": "Zone0_Terrain",
                    "asset": {
                        "asset_id": "7fec86",
                        "asset_type": "glb",
                        "paths": []
                    },
                    "collision": {
                        "enabled": true,
                        "shapePlacement": "StaticBodyChild",
                        "ShapeType": "Trimesh",
                        "containerName": "Hug_Zone00_Terrain_Mesh_Collisions"
                    }
                },
                {
                    "name": "Zone2_Terrain",
                    "asset": {
                        "asset_id": "4280a0",
                        "asset_type": "glb",
                        "paths": []
                    },
                    "collision": {
                        "enabled": true,
                        "shapePlacement": "StaticBodyChild",
                        "ShapeType": "Trimesh",
                        "containerName": "Hug_Zone02_Terrain_Mesh_Collisions"
                    }
                },
                {
                    "name": "Zone3_Terrain",
                    "asset": {
                        "asset_id": "b0bfb4",
                        "asset_type": "glb",
                        "paths": []
                    },
                    "collision": {
                        "enabled": true,
                        "shapePlacement": "StaticBodyChild",
                        "ShapeType": "Trimesh",
                        "containerName": "Hug_Zone03_Terrain_Mesh_Collisions"
                    }
                },
                {
                    "name": "Zone4_Terrain",
                    "asset": {
                        "asset_id": "fa496a",
                        "asset_type": "glb",
                        "paths": []
                    },
                    "collision": {
                        "enabled": true,
                        "shapePlacement": "StaticBodyChild",
                        "ShapeType": "Trimesh",
                        "containerName": "Hug_Zone04_Terrain_Mesh_Collisions"
                    }
                },
                {
                    "name": "Zone5_Terrain",
                    "asset": {
                        "asset_id": "5f4c5f",
                        "asset_type": "glb",
                        "paths": []
                    },
                    "collision": {
                        "enabled": true,
                        "shapePlacement": "StaticBodyChild",
                        "ShapeType": "Trimesh",
                        "containerName": "Hug_Zone05_Terrain_Mesh_Collisions"
                    }
                },
                {
                    "name": "Zone6_Terrain",
                    "asset": {
                        "asset_id": "c47c86",
                        "asset_type": "glb",
                        "paths": []
                    },
                    "collision": {
                        "enabled": true,
                        "shapePlacement": "StaticBodyChild",
                        "ShapeType": "Trimesh",
                        "containerName": "Hug_Zone06_Terrain_Mesh_Collisions"
                    }
                },
                {
                    "name": "Zone7_Terrain",
                    "asset": {
                        "asset_id": "3d96ca",
                        "asset_type": "glb",
                        "paths": []
                    },
                    "collision": {
                        "enabled": true,
                        "shapePlacement": "StaticBodyChild",
                        "ShapeType": "Trimesh",
                        "containerName": "Hug_Zone07_Terrain_Mesh_Collisions"
                    }
                },
                {
                    "name": "Zone9_Terrain",
                    "asset": {
                        "asset_id": "12dcba",
                        "asset_type": "glb",
                        "paths": []
                    },
                    "collision": {
                        "enabled": true,
                        "shapePlacement": "StaticBodyChild",
                        "ShapeType": "Trimesh",
                        "containerName": "Hug_Zone09_Terrain_Mesh_Collisions"
                    }
                },
                {
                    "name": "Background_Terrain",
                    "asset": {
                        "asset_id": "46445a",
                        "asset_type": "glb",
                        "paths": []
                    },
                    "collision": {
                        "enabled": false
                    }
                }
            ]
        }]
    }
]