[
    {
        "name": "L04_TreeHugger",
        "path": "Node4D/Node3D/Levels/L04_TreeHugger.tscn",
        "class": "Node3D",
        "type": "scene",
        "children": [{
            "name": "tree_hugger3D",
            "Type": "Node",
            "class": "Node3D",
            "config": {
                "transform": {
                    "position": {"x": -1000, "y": -500.111, "z": 0},
                    "rotation_degrees": {"x": 0, "y": 0, "z": 0},
                    "scale": {"x": 1, "y": 1, "z": 1}
                }
            },
            "children": [
                {
                    "name": "Zone0_Terrain",
                    "path": "assets/L04_TreeHugger/tree_hugger/zone00_str/assets/environs_zone00/export/terrain/lodmodel1_7fec86.rws.PS3.glb",
                    "index": {
                        "index_id": -1,
                        "index_source_file_name": "lodmodel1.rws.PS3.glb",
                        "index_source_path": "",
                        "index_file_hash": "",
                        "paths": [
                            "L04_TreeHugger/tree_hugger/zone00_str/assets/environs_zone00/export/terrain/lodmodel1_7fec86.rws.PS3.glb",
                            ""
                        ]
                    },
                    "collision": {
                        "enabled": true,
                        "shapePlacement": "StaticBodyChild",
                        "ShapeType": "Trimesh",
                        "containerName": "Hug_Zone00_Terrain_Mesh_Collisions"
                    }
                },
                {
                    "name": "Zone2_Terrain",
                    "path": "assets/L04_TreeHugger/tree_hugger/zone02_str/assets/environs_zone02/export/terrain/lodmodel1_4280a0.rws.PS3.glb",
                    "index": {
                        "index_id": -1,
                        "index_source_file_name": "lodmodel1.rws.PS3.glb",
                        "index_source_path": "",
                        "index_file_hash": "",
                        "paths": [
                            "L04_TreeHugger/tree_hugger/zone02_str/assets/environs_zone02/export/terrain/lodmodel1_4280a0.rws.PS3.glb",
                            ""
                        ]
                    },
                    "collision": {
                        "enabled": true,
                        "shapePlacement": "StaticBodyChild",
                        "ShapeType": "Trimesh",
                        "containerName": "Hug_Zone02_Terrain_Mesh_Collisions"
                    }
                },
                {
                    "name": "Zone3_Terrain",
                    "path": "assets/L04_TreeHugger/tree_hugger/zone03_str/assets/environs_zone03/export/terrain/lodmodel1_b0bfb4.rws.PS3.glb",
                    "index": {
                        "index_id": -1,
                        "index_source_file_name": "lodmodel1.rws.PS3.glb",
                        "index_source_path": "",
                        "index_file_hash": "",
                        "paths": [
                            "L04_TreeHugger/tree_hugger/zone03_str/assets/environs_zone03/export/terrain/lodmodel1_b0bfb4.rws.PS3.glb",
                            ""
                        ]
                    },
                    "collision": {
                        "enabled": true,
                        "shapePlacement": "StaticBodyChild",
                        "ShapeType": "Trimesh",
                        "containerName": "Hug_Zone03_Terrain_Mesh_Collisions"
                    }
                },
                {
                    "name": "Zone4_Terrain",
                    "path": "assets/L04_TreeHugger/tree_hugger/zone04_str/assets/environs_zone04/export/terrain/lodmodel1_fa496a.rws.PS3.glb",
                    "index": {
                        "index_id": -1,
                        "index_source_file_name": "lodmodel1.rws.PS3.glb",
                        "index_source_path": "",
                        "index_file_hash": "",
                        "paths": [
                            "L04_TreeHugger/tree_hugger/zone04_str/assets/environs_zone04/export/terrain/lodmodel1_fa496a.rws.PS3.glb",
                            ""
                        ]
                    },
                    "collision": {
                        "enabled": true,
                        "shapePlacement": "StaticBodyChild",
                        "ShapeType": "Trimesh",
                        "containerName": "Hug_Zone04_Terrain_Mesh_Collisions"
                    }
                },
                {
                    "name": "Zone5_Terrain",
                    "path": "assets/L04_TreeHugger/tree_hugger/zone05_str/assets/environs_zone05/export/terrain/lodmodel1_5f4c5f.rws.PS3.glb",
                    "index": {
                        "index_id": -1,
                        "index_source_file_name": "lodmodel1.rws.PS3.glb",
                        "index_source_path": "",
                        "index_file_hash": "",
                        "paths": [
                            "L04_TreeHugger/tree_hugger/zone05_str/assets/environs_zone05/export/terrain/lodmodel1_5f4c5f.rws.PS3.glb",
                            ""
                        ]
                    },
                    "collision": {
                        "enabled": true,
                        "shapePlacement": "StaticBodyChild",
                        "ShapeType": "Trimesh",
                        "containerName": "Hug_Zone05_Terrain_Mesh_Collisions"
                    }
                },
                {
                    "name": "Zone6_Terrain",
                    "path": "assets/L04_TreeHugger/tree_hugger/zone06_str/assets_environs_zone06/export/terrain/lodmodel1_c47c86.rws.PS3.glb",
                    "index": {
                        "index_id": -1,
                        "index_source_file_name": "lodmodel1.rws.PS3.glb",
                        "index_source_path": "",
                        "index_file_hash": "",
                        "paths": [
                            "L04_TreeHugger/tree_hugger/zone06_str/assets_environs_zone06/export/terrain/lodmodel1_c47c86.rws.PS3.glb",
                            ""
                        ]
                    },
                    "collision": {
                        "enabled": true,
                        "shapePlacement": "StaticBodyChild",
                        "ShapeType": "Trimesh",
                        "containerName": "Hug_Zone06_Terrain_Mesh_Collisions"
                    }
                },
                {
                    "name": "Zone7_Terrain",
                    "path": "assets/L04_TreeHugger/tree_hugger/zone07_str/assets_environs_zone07/export/terrain/lodmodel1_3d96ca.rws.PS3.glb",
                    "index": {
                        "index_id": -1,
                        "index_source_file_name": "lodmodel1.rws.PS3.glb",
                        "index_source_path": "",
                        "index_file_hash": "",
                        "paths": [
                            "L04_TreeHugger/tree_hugger/zone07_str/assets_environs_zone07/export/terrain/lodmodel1_3d96ca.rws.PS3.glb",
                            ""
                        ]
                    },
                    "collision": {
                        "enabled": true,
                        "shapePlacement": "StaticBodyChild",
                        "ShapeType": "Trimesh",
                        "containerName": "Hug_Zone07_Terrain_Mesh_Collisions"
                    }
                },
                {
                    "name": "Zone9_Terrain",
                    "path": "assets/L04_TreeHugger/tree_hugger/zone09_str/assets/environs_zone09/export/terrain/lodmodel1_12dcba.rws.PS3.glb",
                    "index": {
                        "index_id": -1,
                        "index_source_file_name": "lodmodel1.rws.PS3.glb",
                        "index_source_path": "",
                        "index_file_hash": "",
                        "paths": [
                            "L04_TreeHugger/tree_hugger/zone09_str/assets/environs_zone09/export/terrain/lodmodel1_12dcba.rws.PS3.glb",
                            ""
                        ]
                    },
                    "collision": {
                        "enabled": true,
                        "shapePlacement": "StaticBodyChild",
                        "ShapeType": "Trimesh",
                        "containerName": "Hug_Zone09_Terrain_Mesh_Collisions"
                    }
                },
                {
                    "name": "Background_Terrain",
                    "path": "assets/L04_TreeHugger/tree_hugger_str/assets/props/eps_treehugger_hug_background_geo/export_hug_background/model1_46445a.rws.PS3.glb",
                    "index": {
                        "index_id": -1,
                        "index_source_file_name": "model1.rws.PS3.glb",
                        "index_source_path": "",
                        "index_file_hash": "",
                        "paths": [
                            "L04_TreeHugger/tree_hugger_str/assets/props/eps_treehugger_hug_background_geo/export_hug_background/model1_46445a.rws.PS3.glb",
                            ""
                        ]
                    },
                    "collision": {
                        "enabled": false
                    }
                }
            ]
        }]
    }
]