[
    {
        "name": "L03_HungryHungryHomer",
        "path": "Node4D/Node3D/Levels/L03_HungryHungryHomer.tscn",
        "class": "Node3D",
        "type": "scene",
        "children": [{
            "name": "eighty_bites3D",
            "Type": "Node",
            "class": "Node3D",
            "path": "Node4D/Node3D/Levels/L03_HungryHungryHomer/eighty_bites3D.tscn",
            "config": {
                "transform": {
                    "position": {"x": 1000, "y": -400.111, "z": 0},
                    "rotation_degrees": {"x": 0, "y": 0, "z": 0},
                    "scale": {"x": 1, "y": 1, "z": 1}
                }
            },
            "children": [
                {
                    "name": "Zone1_Terrain",
                    "asset": {
                        "asset_id": "592a6f",
                        "asset_type": "glb",
                        "paths": []
                    },
                    "collision": {
                        "enabled": true,
                        "shapePlacement": "StaticBodyChild",
                        "ShapeType": "Trimesh",
                        "containerName": "80b_Zone01_Terrain_Mesh_Collisions"
                    }
                },
                {
                    "name": "Zone2_Terrain",
                    "asset": {
                        "asset_id": "eacd0a",
                        "asset_type": "glb",
                        "paths": []
                    },
                    "collision": {
                        "enabled": true,
                        "shapePlacement": "StaticBodyChild",
                        "ShapeType": "Trimesh",
                        "containerName": "80b_Zone02_Terrain_Mesh_Collisions"
                    }
                },
                {
                    "name": "Zone3_Terrain",
                    "asset": {
                        "asset_id": "2ff71d",
                        "asset_type": "glb",
                        "paths": []
                    },
                    "collision": {
                        "enabled": true,
                        "shapePlacement": "StaticBodyChild",
                        "ShapeType": "Trimesh",
                        "containerName": "80b_Zone03_Terrain_Mesh_Collisions"
                    }
                },
                {
                    "name": "Zone4_Terrain",
                    "asset": {
                        "asset_id": "833f42",
                        "asset_type": "glb",
                        "paths": []
                    },
                    "collision": {
                        "enabled": true,
                        "shapePlacement": "StaticBodyChild",
                        "ShapeType": "Trimesh",
                        "containerName": "80b_Zone04_Terrain_Mesh_Collisions"
                    }
                },
                {
                    "name": "Zone5_Terrain",
                    "asset": {
                        "asset_id": "36aea4",
                        "asset_type": "glb",
                        "paths": []
                    },
                    "collision": {
                        "enabled": true,
                        "shapePlacement": "StaticBodyChild",
                        "ShapeType": "Trimesh",
                        "containerName": "80b_Zone05_Terrain_Mesh_Collisions"
                    }
                },
                {
                    "name": "Zone6_Terrain",
                    "asset": {
                        "asset_id": "b9da23",
                        "asset_type": "glb",
                        "paths": []
                    },
                    "collision": {
                        "enabled": true,
                        "shapePlacement": "StaticBodyChild",
                        "ShapeType": "Trimesh",
                        "containerName": "80b_Zone06_Terrain_Mesh_Collisions"
                    }
                },
                {
                    "name": "Zone7_Terrain",
                    "asset": {
                        "asset_id": "93345b",
                        "asset_type": "glb",
                        "paths": []
                    },
                    "collision": {
                        "enabled": true,
                        "shapePlacement": "StaticBodyChild",
                        "ShapeType": "Trimesh",
                        "containerName": "80b_Zone07_Terrain_Mesh_Collisions"
                    }
                }
            ]
        }]
    }
]