[
    {
        "name": "Node4D",
        "path": "Node4D.tscn",
        "class": "Node",
        "type": "scene",
        "editable_children_default": false,
        "children": [
            {
                "name": "Node2D",
                "path": "Node4D/Node2D.tscn",
                "config_file": "Node4D/Node2D.json"
            },
            {
                "name": "Node3D",
                "path": "Node4D/Node3D.tscn",
                "config_file": "Node4D/Node3D.json"
            }
        ]
    }
]