[
    {
        "name": "L06_EnterTheCheatrix",
        "path": "Node4D/Node3D/Levels/L06_EnterTheCheatrix.tscn",
        "class": "Node3D",
        "type": "scene",
        "children": [{
            "name": "cheater3D",
            "Type": "Node",
            "class": "Node3D",
            "path": "Node4D/Node3D/Levels/L06_EnterTheCheatrix/cheater3D.tscn",
            "config": {
                "transform": {
                    "position": {"x": -1000, "y": -700.111, "z": 0},
                    "rotation_degrees": {"x": 0, "y": 0, "z": 0},
                    "scale": {"x": 1, "y": 1, "z": 1}
                }
            }
        }]
    }
]