[
    {
        "name": "Levels",
        "path": "Node4D/Node3D/Levels.tscn",
        "class": "Node3D",
        "type": "scene",
        "children": [
            {
                "name": "LHub-00_GameHub",
                "path": "Node4D/Node3D/Levels/LHub-00_GameHub.tscn",
                "config_file": "Node4D/Node3D/Levels/LHub-00_GameHub.json"
            },
            {
                "name": "LHub-00_SprHub",
                "path": "Node4D/Node3D/Levels/LHub-00_SprHub.tscn",
                "config_file": "Node4D/Node3D/Levels/LHub-00_SprHub.json"
            },
            {
                "name": "L01_LandOfChocolate",
                "path": "Node4D/Node3D/Levels/L01_LandOfChocolate.tscn",
                "config_file": "Node4D/Node3D/Levels/L01_LandOfChocolate.json"
            },
            {
                "name": "L02_BartmanBegins",
                "path": "Node4D/Node3D/Levels/L02_BartmanBegins.tscn",
                "config_file": "Node4D/Node3D/Levels/L02_BartmanBegins.json"
            },
            {
                "name": "L03_HungryHungryHomer",
                "path": "Node4D/Node3D/Levels/L03_HungryHungryHomer.tscn",
                "config_file": "Node4D/Node3D/Levels/L03_HungryHungryHomer.json"
            },
            {
                "name": "L04_TreeHugger",
                "path": "Node4D/Node3D/Levels/L04_TreeHugger.tscn",
                "config_file": "Node4D/Node3D/Levels/L04_TreeHugger.json"
            },
            {
                "name": "L05_MobRules",
                "path": "Node4D/Node3D/Levels/L05_MobRules.tscn",
                "config_file": "Node4D/Node3D/Levels/L05_MobRules.json"
            },
            {
                "name": "L06_EnterTheCheatrix",
                "path": "Node4D/Node3D/Levels/L06_EnterTheCheatrix.tscn",
                "config_file": "Node4D/Node3D/Levels/L06_EnterTheCheatrix.json"
            },
            {
                "name": "L07_DayOfTheDolphin",
                "path": "Node4D/Node3D/Levels/L07_DayOfTheDolphin.tscn",
                "config_file": "Node4D/Node3D/Levels/L07_DayOfTheDolphin.json"
            },
            {
                "name": "L08_TheColossalDonut",
                "path": "Node4D/Node3D/Levels/L08_TheColossalDonut.tscn",
                "config_file": "Node4D/Node3D/Levels/L08_TheColossalDonut.json"
            },
            {
                "name": "L09_Invasion",
                "path": "Node4D/Node3D/Levels/L09_Invasion.tscn",
                "config_file": "Node4D/Node3D/Levels/L09_Invasion.json"
            },
            {
                "name": "L10_BargainBin",
                "path": "Node4D/Node3D/Levels/L10_BargainBin.tscn",
                "config_file": "Node4D/Node3D/Levels/L10_BargainBin.json"
            },
            {
                "name": "L11_NeverQuest",
                "path": "Node4D/Node3D/Levels/L11_NeverQuest.tscn",
                "config_file": "Node4D/Node3D/Levels/L11_NeverQuest.json"
            },
            {
                "name": "L12_GrandTheftScratchy",
                "path": "Node4D/Node3D/Levels/L12_GrandTheftScratchy.tscn",
                "config_file": "Node4D/Node3D/Levels/L12_GrandTheftScratchy.json"
            },
            {
                "name": "L13_MedalOfHomer",
                "path": "Node4D/Node3D/Levels/L13_MedalOfHomer.tscn",
                "config_file": "Node4D/Node3D/Levels/L13_MedalOfHomer.json"
            },
            {
                "name": "L14_BigSuperHappy",
                "path": "Node4D/Node3D/Levels/L14_BigSuperHappy.tscn",
                "config_file": "Node4D/Node3D/Levels/L14_BigSuperHappy.json"
            },
            {
                "name": "L15_Rhymes",
                "path": "Node4D/Node3D/Levels/L15_Rhymes.tscn",
                "config_file": "Node4D/Node3D/Levels/L15_Rhymes.json"
            },
            {
                "name": "L16_MeetThyPlayer",
                "path": "Node4D/Node3D/Levels/L16_MeetThyPlayer.tscn",
                "config_file": "Node4D/Node3D/Levels/L16_MeetThyPlayer.json"
            }
        ]
    }
]