[
    {
        "name": "Terminal_ControlNode",
        "path": "Node4D/Node2D/Terminal_ControlNode.tscn",
        "script": "Node4D/Node2D/Terminal_ControlNode.gd",
        "class": "Control",
        "type": "scene",
        "children": [
            {
                "name": "CanvasLayer",
                "class": "CanvasLayer",
                "path": "Node4D/Node2D/Terminal_ControlNode/CanvasLayer.tscn",
                "config_file": "Node4D/Node2D/Terminal_ControlNode/CanvasLayer.json",
                "type": "scene"
            }
        ]
    }
]