[
    {
        "name": "Panel",
        "class": "Panel",
        "path": "Node4D/Node2D/Terminal_ControlNode/CanvasLayer/Panel.tscn",
        "type": "scene",
        "children": [
            {
                "name": "VideoPlayer",
                "class": "VideoStreamPlayer",
                "type": "Node",
                "config_file": "Node4D/Node2D/Terminal_ControlNode/CanvasLayer/Panel/VideoPlayer.json",
                "config": {
                    "offsets": {
                        "offset_left": 0.0,
                        "offset_top": -1.0,
                        "offset_right": 1150.0,
                        "offset_bottom": 645.0
                    }
                }
            },
            {
                "name": "InputField",
                "class": "LineEdit",
                "type": "Node",
                "config_file": "Node4D/Node2D/Terminal_ControlNode/CanvasLayer/Panel/InputField.json",
                "config": {
                    "offsets": {
                        "offset_left": 6.0,
                        "offset_top": 602.0,
                        "offset_right": 1141.0,
                        "offset_bottom": 633.0
                    }
                }
            },
            {
                "name": "OutputField",
                "class": "RichTextLabel",
                "type": "Node",
                "config_file": "Node4D/Node2D/Terminal_ControlNode/CanvasLayer/Panel/OutputField.json",
                "config": {
                    "offsets": {
                        "offset_left": 0.0,
                        "offset_top": 1.0,
                        "offset_right": 1150.0,
                        "offset_bottom": 590.0
                    }
                }
            }
        ]
    }
]